id,name,steps,image_url,created_at,updated_at,cuisine_id
53,Nutella Buttercream Cupcakes with Hidden Cadbury Egg,"Preheat oven to 350 degrees.
Grease 6 jumbo muffin tin.
Combine cake mix milk, vanilla and oil. Mix till combined.
Add eggs beat till mixed well. Bake for 18- 21 min
After cooking cupcakes use a spoon and cut out enough area to insert Cadbury egg.
Making sure the smaller part of the egg is facing up.
Frost the cupcake hiding the Cadbury egg.",https://spoonacular.com/recipeImages/991625-556x370.jpg,2022-10-28 13:49:46 UTC,2022-10-28 13:49:46 UTC,
54,Creamy Chicken Orzo Soup,"In a large pot over medium heat, saute the vegetables in olive oil for about 10 minutes, until vegetables are tender.
Add the drained can of chicken and stir.
Season the chicken and vegetables with salt and pepper. Stir.
Increase the heat to medium-high and add the chicken broth plus 2 cans of warm water and stir.
Allow the soup to simmer for 15 minutes then add the uncooked pasta and seasoning. Stir.
Let the soup simmer for 20 minutes, stirring occasionally.
Add the condensed soup, stir until the broth is creamy and serve.",https://spoonacular.com/recipeImages/640619-556x370.jpg,2022-10-28 13:49:46 UTC,2022-10-28 13:49:46 UTC,
55,Easter Nest Sweet Cake With Sour Cream-Royal Icing and Pistachios,"<ol><li>Preheat oven to 190 C/ 375 F and lightly grease a ring cake pan. Set aside.</li><li>In a medium bowl--and using an electric mixer-- beat sugar, eggs, and butter until creamy.</li><li>Add sour cream and flour and mix  for a couple of minutes.</li><li>Pour  mixture into cake pan.</li><li>Bake for 20 minutes or until golden brown and cooked through when tested with a skewer.</li><li>To make the icing, use a standard mixer to beat the egg white until soft stiff peaks are formed. Add lemon juice and sugar and food coloring. Beat for a couple of seconds more.</li><li>Let the cake cool on a wire rack for about 10 minutes. Then pour the royal icing/glaze onto the cake, sprinkle with chopped pistachios, and decorate as desired.</li></ol>",https://spoonacular.com/recipeImages/641799-556x370.jpg,2022-10-28 13:49:50 UTC,2022-10-28 13:49:50 UTC,
56,Chocolate Almond Bark,"<ol><li>Heat oven to 160 degrees.</li><li>In a medium bowl, mix  cup chopped almonds with the Worcestershire sauce, cayenne and sea salt.</li><li>Place on baking sheet and roast for 20 minutes.</li><li>Let the almonds cool.</li><li>Melt the chocolate using a double boiler or in the microwave (be sure to use low heat) and mix the almonds into the chocolate.</li><li>Spread into wax-paper lined 8 x 8 inch baking pan.</li><li>Sprinkle a pinch more of the sea salt on the top and let cool.</li><li>Break into bite-size pieces.</li></ol>",https://spoonacular.com/recipeImages/638808-556x370.jpg,2022-10-28 13:49:50 UTC,2022-10-28 13:49:50 UTC,
57,Avocado Nests,"Cook hash browns according to direction.
Cut bacon slices into thin strips and bake or fry as you prrefere.
Make deviled eggs; mix a bit of mayonaise or cream cheese with egg yolks and divide equally into the egg white halves.
Cut avocados in half, remove seed and peel.
Place hash browns on plate and sprinkle with bacon.
Place eggs into seed cavity of avocados.
Rest avocados on the bed of hash browns and bacon.",https://spoonacular.com/recipeImages/633144-556x370.jpg,2022-10-28 13:49:51 UTC,2022-10-28 13:49:51 UTC,
58,Bacon Ice Cream,"<ol><li>Mix bacon and nuts in bowl. Set aside a teaspoon of bacon and nuts for topping.</li><li>Mix chopped bacon and nuts into ice cream, then place back in freezer.</li><li>After Bacon Ice Cream is frozen, scoop into cup and top with bits of bacon and nuts. Enjoy!</li></ol>",https://spoonacular.com/recipeImages/633314-556x370.jpg,2022-10-28 13:49:52 UTC,2022-10-28 13:49:52 UTC,
59,Curried Cauliflower Gratin,"<ol><li>Preheat the oven to 400 F. Butter an 8x8-inch baking dish and set aside.</li><li>Steam the whole cauliflower until tender but not soggy (about 15 minutes). Cool and slice the cauliflower horizontally.</li><li>Heat the peanut oil in a saucepan over medium heat. Add the ginger, shallot, and garlic; saute for 3 to 4 minutes. Add the dry spices and saute until aromatic, about 3 minutes. Sprinkle in the flour and stir to cook, about 2 minutes. Whisk in the coconut milk and salt and cook at a simmer, stirring, about 3 to 5 minutes (until thickened).</li><li>Layer the cauliflower slices and curry cream in the prepared baking dish.</li><li>Sprinkle the cumin seeds and breadcrumbs over the cauliflower and curry cream. Drizzle the breadcrumbs with the melted butter. Bake for 25 to 30 minutes until golden brown and bubbling.</li><li>Sprinkle the finished dish with the minced cilantro and serve.</li></ol>",https://spoonacular.com/recipeImages/641063-556x370.jpg,2022-10-28 13:49:52 UTC,2022-10-28 13:49:52 UTC,
60,German Rhubarb Cake with Meringue,"Preheat the oven to 350F Convection. Grease a round 26 cm Spring pan (9 1/2 inch).
Wash, dry and peel the rhubarb. Cut it in little pieces, mix with 2 tablespoon of sugar and let sit for at least 1/2 hour. It will extract a lot of water that needs to be drained. Pat rhubarb dry for further use.
In a kitchen machine beat together butter, sugar and vanilla extract until the butter is fluffy and the sugar is dissolved. Put in the eggs, one at a time and mix well.
In a separate bowl sift together flour, ground almonds, salt and baking powder, add slowly to the egg mixture. Dont over mix.
Fill dough into the spring pan, top with dried rhubarb and bake for 25 min.
In the mean time prepare the meringue/ baiser topping. Beat egg whites until stiff peaks form. Slowly add the sugar until meringue is firm and shiny.
Spread the meringue evenly over the rhubarb and decorate with almond slices. Return to the oven for another 15 min. Cover the cake with aluminum foil after 5 min. in case the meringue does turn too dark.
Cool completely before removing the cake from the pan.",https://spoonacular.com/recipeImages/644488-556x370.jpg,2022-10-28 13:49:56 UTC,2022-10-28 13:49:56 UTC,
61,Sun Dried Tomato and Herb Baked Eggs,<ol><li>Preheat oven to 350 F.</li><li>Cover the inside of one ramekin or oven safe dish with olive oil.</li><li>Line the bottom of the dish with sundried tomatoes and break two eggs on top. Sprinkle with fresh herbs.</li><li>Bake uncovered for 15-20 minutes until egg whites are firm.</li><li>Serve immediately.</li></ol>,https://spoonacular.com/recipeImages/662276-556x370.jpg,2022-10-28 13:49:57 UTC,2022-10-28 13:49:57 UTC,
62,Candied Spiced Pecans,"<ol><li>Preheat oven to 300 F.</li><li>Line a cookie sheet with tin foil and coat with cooking spray. Set aside.</li><li>In a shallow bowl sift together granulated sugar, cinnamon, allspice, cloves, and nutmeg. Set aside.</li><li>In a small bowl, whisk together maple extract, brown sugar and water.</li><li>Over medium heat, melt butter in a skillet. Slowly whisk in brown sugar mixture and bring to a boil. Add pecans and stir to coat. Simmer for about 1-2 minutes until well coated.</li><li>With a slotted spoon, transfer pecans to the reserved sugar and spice bowl. Coat pecans with sugar.</li><li>Place pecans evenly on prepared cookie sheet and bake for 15 minutes. Stir pecans and bake for an additional 15 minutes. Let cool completely before serving.</li></ol>",https://spoonacular.com/recipeImages/636864-556x370.jpg,2022-10-28 13:49:57 UTC,2022-10-28 13:49:57 UTC,
63,Chocolate Chip Peanut Butter Banana Cookies,"<ol><li>Preheat oven to 350 degrees.</li><li>In a large bowl, mash 2 ripened bananas.</li><li>Add butter, peanut butter, both sugars, egg, vanilla and stir.</li><li>In a separate bowl, whisk together flour, baking powder, baking soda, cinnamon and salt.</li><li>Add dry ingredients to banana mixture and stir until combined (do not stir this to death!)</li><li>Add mini chocolate chips and briefly stir.</li><li>Drop by large spoonful onto parchment lined baking sheet.</li><li>In a small bowl, pour 1/4 cup of sugar and 1/2 tsp of cinnamon and stir.  Sprinkle over unbaked cookies.</li><li>Bake for 10-12 minutes or until slightly golden brown.  My oven is hot, and only needs 10 minutes.  </li></ol>",https://spoonacular.com/recipeImages/638940-556x370.jpg,2022-10-28 13:49:58 UTC,2022-10-28 13:49:58 UTC,
64,Delicious Rhubarb Custard Pie,"<ol><li>Combine all the ingredients except the eggs and butter in a large bowl.</li><li>Put the mixture into a pre-baked pie crust.</li><li>Pour the beaten eggs over the rhubarb mixture.</li><li>Drizzle the melted butter over the top of the pie. Make sure all the rhubarb is covered with the eggs/butter.</li><li>Bake at 400 F (220 C) for 50 minutes. Since the crust has already been baked, you might want to tent some aluminum foil around the edges of the pie so that the exposed part of the crust doesn't get too brown.</li></ol>",https://spoonacular.com/recipeImages/641410-556x370.jpg,2022-10-28 13:50:00 UTC,2022-10-28 13:50:00 UTC,
65,Mardi Gras Shrimp touffe,"<p>Heat up a heavy pot over low heat. Add in the butter and cook for about 10-12 minutes until a light golden brown. Be sure to stir around a few times to prevent burning.</p><p>Whisk in the flour until smooth and cook again for about 8 minutes on low. It should look like a slightly loose peanut butter when its ready.</p><p>Add in the bell peppers, celery and onion. Stir and coat the veggies with the roux. Cook for another 10-15 minutes, until the veggies are softened.</p><p>Stir in the garlic and thyme and cook for a minute, until the garlic is fragrant.</p><p>Add in the tomato paste, Worcestershire sauce, creole seasoning and broth. Simmer on low for 30-40 minutes until slightly thickened. Stir occasionally.</p><p>Stir in the shrimp, shut the heat and put the lid on. Allow to cook for about 5-8 minutes or until cooked through. Stir in a Tbsp of butter right at the end.</p><p>Serve over rice and garnish with sliced scallion and fresh diced tomato.</p>",https://spoonacular.com/recipeImages/1098393-556x370.jpg,2022-10-28 13:50:00 UTC,2022-10-28 13:50:00 UTC,
66,Brown sugar & Spice Sugar cookie frogs,"Whisk the flour, baking powder and spices, set aside.
Cream the sugar and butter. Add the egg and extracts and mix until well-blended.
Gradually add the flour mixture and beat just until combined, scraping down the bowl, especially the bottom. (The dough will be quite thick...you may need to knead in stray bits of flour from the bottom of the bowl by hand.)
Roll on a floured surface and cut into shapes. Place on parchment lined baking sheets and bake for 9-12 minutes, depending on the size of your cutter. Let sit a few minutes on the sheet, then transfer to a cooling rack.",https://spoonacular.com/recipeImages/636300-556x370.jpg,2022-10-28 13:50:03 UTC,2022-10-28 13:50:03 UTC,
67,Coastal Avocado Salad with Grapes and Shrimp,"In a medium bowl, combine the shrimp, grapes, celery, water chestnuts and the sliced whites of the green onion. In a small bowl, combine the mayonnaise, sherry, salt, pepper, sesame oil and dry mustard. Gently mix with shrimp and grape mixture. Sprinkle with the sliced green part of the onion and the sesame seeds. Refrigerate until ready to serve. Serves 4.
Nutritional analysis per serving: Calories 227; Protein 25 g; Carbohydrate 13 g; Fat 8 g; 31% Calories from Fat; Cholesterol 226 mg; Sodium 457 mg; Potassium 362 mg; Fiber 3 g.",https://spoonacular.com/recipeImages/639672-556x370.jpg,2022-10-28 13:50:04 UTC,2022-10-28 13:50:04 UTC,
68,Cherry ice cream,"<ol><li>Put cherries, milk, one cup of the cream, sugar, and salt into a medium saucepan. Heat on medium heat until the mixture is steamy, then lower the heat and let sit for about 15 minutes. Remove from heat.</li><li>Pour mixture into a blender, and carefully pure ( because of the hot liquid).</li><li>Put mixture into a large bowl and stir in the remaining  cup of cream. Chill for several hours in the refrigerator until completely cold.</li><li>Stir in cornstarch, lemon juice and Amaretto.</li><li>Pour the mixture into an ice cream machine and churn until frozen. Transfer to plastic container and place in the freezer for an hour before serving.</li><li>Serving: take it out for 5-10 minutes before serving, or longer, so it comes to the right scooping temperature.</li></ol>",https://spoonacular.com/recipeImages/637761-556x370.jpg,2022-10-28 13:50:08 UTC,2022-10-28 13:50:08 UTC,
69,Moroccan kofte and sausage stew,"Mix the beef, onion, chilli, spices and the chopped coriander leaves.
Add the egg and salt, mix and combine.
Form small meatballs about the size of a walnut (approximately 26 meatballs).
Fry the meatballs and the sausage in olive oil in a large frying pan until browned all over (you may need to do this in batches).
Scoop out, then add the harissa* and cook for a minute.
Add the tomatoes, chicken stock and cinnamon. Simmer for 15 minutes.
Return the meatballs and sausage and simmer for another 20 minutes, until cooked.
Stir through the rest of the coriander to finish.
*Harissa:
Soak the dried chilies in hot water for 30 minutes. Drain. Remove stems and seeds.
In a food processor blend chili peppers, garlic, salt, and olive oil.
Add remaining spices and blend to form a smooth paste.
Drizzle a small amount of olive oil on top to keep fresh.
Store in airtight container and keep for a month in the refrigerator.",,2022-10-28 13:50:08 UTC,2022-10-28 13:50:08 UTC,
70,"Banana, Cranberry and Apple Bread","<ol><li>Line and greased a loaft pan. (I used cooking spray to grease the pan) Pre-heat the oven to 350 degree F (170 C).</li><li>In a mixing bowl, combined flour, baking powder, baking soda, salt and sugar. Mix well and set it aside.</li><li>In another mixing bowl, combined eggs, milk, oil, vanilla, grated apple and mashed bananas. Mix it well with a big spoon. Add in the dry ingredients into the eggs mixture. Mix until combined.</li><li>Lastly add in dried cranberries. Mix well and pour it into the baking pan. Bake for 70 minutes or skewer inserted into bread and comes out clean.</li></ol>",https://spoonacular.com/recipeImages/634213-556x370.jpg,2022-10-28 13:50:12 UTC,2022-10-28 13:50:12 UTC,
71,Dried Fruit and Ginger Scones,"<ol><li>Position a rack in the middle of your oven and preheat to 425F.  If you will be baking on a pizza stone, put it in the oven to preheat as well.  If you will be using a cookie sheet, line it with parchment paper and set it aside.</li><li>Whisk together the flours, baking powder, 3 TB of the sugar, and salt in a medium bowl.</li><li>Cut in the butter using a pastry blender, two knives, or your fingers, until the largest chunks of butter are the size of small peas.</li><li>Pour in the cream and milk (or just use all cream, if you have it) and mix it around with a fork until an evenly hydrated, extremely sticky dough forms.</li><li>Add the fruits and mix again until evenly distributed (you may have to work a bit to break up the ginger pieces).</li><li>Dump the sticky mass out onto a well-floured board.  Sprinkle a little flour on top as well, then pat the dough out into a circle about 1-inch thick.  Try not to add too much flour, lest they become dense and tough.  Dip a pizza cutter or other thin, sharp knife into flour, then cut the circle into 8 equal sized pieces.  You may need to scrape off and re-flour your slicing instrument between slices.</li><li>Using a bench scraper, a thin spatula, or (if you are brave) your hands, relocate your 8 scones to your prepared baking vessel, spacing them a half inch or so apart (they will puff and rise a little bit, but not tremendously).  Sprinkle the tops with the remaining 1 TB of sugar.</li><li>Bake for 13-15 minutes, or until lightly golden on top and cooked through.</li><li>Cool at least 10 minutes before removing to a wire rack.  Eat warm or cool.</li></ol>",https://spoonacular.com/recipeImages/641651-556x370.jpg,2022-10-28 13:50:13 UTC,2022-10-28 13:50:13 UTC,
72,Bananas Foster Ice Cream,"In a heavy bottomed saucepan, heat the milk, salt and 1/4 cup sugar over med-low heat until steaming but not boiling and the sugar is dissolved.  Add the vanilla bean and vanilla bean caviar to the mixture.  Cover and let steep for 1 hour.
In a small saute pan, melt the butter, brown sugar and salt.  Bring to a boil stirring constantly until the mixture turns a deep golden brown.  Add the bananas and continue to saute the mixture for approximately 5 more minutes or until the bananas soften.  Stir in the rum and remove from heat.  Let the mixture cool to room temperature.
Fill a large bowl with ice and water.  Place a small bowl in the ice water and add the heavy cream.  Top the small bowl with a wire strainer and set aside.
In a small bowl, whisk together the egg yolks and remaining 1/4 cup sugar until light in color and ribbons begin to form.
Reheat the milk mixture over med-low heat and slowly add to egg mixture whisking constantly so the eggs do not scramble.  Return the milk/egg mixture to the pan and heat. Stir constantly with a heat resistant spatula being sure to scrape the sides and bottom until it begins to thicken (it will coat the back of the spatula).
Strain the milk mixture into the cream, remove the strainer and stir until combined.  Cover with plastic wrap and chill in the refrigerator for 2 hours or overnight.
Pour the mixture into the freezer can of an electric ice cream maker and freeze according to the manufacturers instructions.  When the mixture reaches soft serve consistency, add the banana mixture and continue churning until combined.
Transfer the ice cream to a freezer safe container and freeze.",https://spoonacular.com/recipeImages/634237-556x370.jpg,2022-10-28 13:50:16 UTC,2022-10-28 13:50:16 UTC,
73,Fall Fruit Compote,"<ol><li>Melt the butter in a medium saucepan over high heat. Add the diced apples, pears, cherries, vinegar, apple juice, brown sugar, and cinnamon stick. Cook for 5 minutes. Lower the heat to medium and cook a few minutes more, until the fruit is tender and the liquid has boiled away. Add a bit more apple juice to keep the fruit from scorching. The compote will keep for a week, refrigerated. Serve warm with potato latkes.</li></ol>",https://spoonacular.com/recipeImages/642554-556x370.jpg,2022-10-28 13:50:17 UTC,2022-10-28 13:50:17 UTC,
74,Easy Bread Pudding and Vans,"Toast waffles according to the package. When cool, cut into 1 inch pieces.Arrange waffle pieces evenly in an 8 x 8 baking dish that has been coated with cooking spray.In a large bowl, whisk together all ingredients, (minus strawberries, chocolate, olive oil, and powdered sugar). Pour over waffles, pressing it in to make the waffle pieces moist. Let the mixture soak while the oven preheats to 325 degrees.Place baking dish on a sheet pan, and bake for 30 to 40 minutes, or until the pudding is set and golden brown.Before serving, sprinkle with powdered sugar. Take your white chocolate chips and place  cup in a microwave safe bowl. Add a tsp of olive oil and heat for 30 seconds. Stir. Heat for an additional 30 seconds, and continue until your chocolate is melted. Glaze the top of your bread pudding with the melted white chocolate, take some of the mashed strawberries and finish topping your bread pudding.",https://spoonacular.com/recipeImages/715508-556x370.jpg,2022-10-28 13:50:20 UTC,2022-10-28 13:50:20 UTC,
75,White chocolate-cranberry ice cream,"<ol><li>In a medium saucepan boil the milk until it starts to bubble gently. Remove from flame and set aside.</li><li>Meanwhile whisk the egg yolks and sugar together for 3 minutes until pale yellow and double in volume.</li><li>Pour the milk on to the egg mixture and stir and then gently pour the mixture back in to the saucepan and simmer very lightly. Stir continuously until the custard mix thickens or coats the back of a wooden spoon.</li><li>Add the chopped chocolate stirring until the heat melts the chocolate.</li><li>Cool the mixture, stir in the vanilla extract and put it in the fridge to chill.</li><li>Once chilled, add the cream to the mixture. Stir and combine.</li><li>Pour the mixture into an ice cream machine and churn until frozen.</li><li>Add  dried cranberries in the last 5 minutes of churning and let the machine stir them in.</li><li>Transfer to plastic container and place in the freezer for 3 hours before serving.</li></ol>",https://spoonacular.com/recipeImages/665203-556x370.jpg,2022-10-28 13:50:22 UTC,2022-10-28 13:50:22 UTC,
76,Crispy Buttermilk Fried Chicken,"Mix flour, salt, paprika and pepper. Dip chicken in buttermilk and then into flour mixture. Cook chicken in oil, starting on medium-high heat, then, when chicken is browned, reduce heat to medium and cook an additional 30 to 35 minutes until chicken is done (approx 150-155 degrees F internal), turning occasionally.",https://spoonacular.com/recipeImages/640803-556x370.jpg,2022-10-28 13:50:23 UTC,2022-10-28 13:50:23 UTC,
77,Philly Cheesesteak Grilled Wraps,"In frying pan over medium-low heat, add onions and cook on low until caramelized (when done properly, this takes about 30 min). Add in the Better than Bouillon Beef Base and a tbsp of water to make a faint gravy.
Add in the mushrooms and bell peppers and cook until softened, about 5 minutes.
On tortilla, spread a thin layer of mayonnaise and top with a few squirts of hot sauce.
Pile on the steak and vegetables.
Roll up, making sure the ends are sealed.
On griddle or in large frying pan sprayed with cooking spray, over medium heat, add the wraps, seam side down, and put something heavy on top (like a smaller frying pan weighted down with something heatproof) and grill until toasted. Flip and repeat. This would work well in an electric grill (like the George Foreman or a panini press)
Once finished, pull off and let sit for a minute before slicing in half.
Enjoy the happy faces around you :)",https://spoonacular.com/recipeImages/655890-556x370.jpg,2022-10-28 13:50:23 UTC,2022-10-28 13:50:23 UTC,
78,Cornmeal-Crusted Catfish with Cajun Seasoning and Spicy Tartar Sauce,"Whisk the egg and milk in a medium bowl. Combine the cornmeal, chile powder, cayenne powder, paprika, and garlic in a large zip-top bag.
Dip each catfish filet in the egg mixture. Let excess egg drip off and place the filets in the bag with the cornmeal mixture. Zip the top and shake the bag until all pieces are well coated.
Remove the filets and lay side by side on a plate (do not overlap). Place in the refrigerator for 30 minutes. (Refrigeration helps keep the crust adhered during cooking.)
While the fish chills, make the sauce. Whisk the first 6 ingredients (through lemon juice) in a small bowl. Season with salt and pepper and set aside.
Heat a large, nonstick skillet over medium heat and add the olive oil. When the oil is hot (but not smoking), season the catfish filets with salt and pepper and add to the skillet. Fry until crispy on the outside and tender on the inside, 3-4 minutes per side, depending on thickness.
Divide the fish among 4 plates and top each with a dollop of tartar sauce or pass the sauce at the table.",https://spoonacular.com/recipeImages/640166-556x370.jpg,2022-10-28 13:50:25 UTC,2022-10-28 13:50:25 UTC,
79,Chilled Cucumber Avocado Soup with Yogurt and Kefir,"",https://spoonacular.com/recipeImages/716437-556x370.jpg,2022-10-28 13:50:29 UTC,2022-10-28 13:50:29 UTC,
80,Enchiladas Verdes (Green Enchiladas),"Roast Chili Peppers
Preheat broiler. Select firm, meaty peppers without wrinkles for roasting. Wash thoroughly. Place peppers evenly in a single layer on a foil-lined cookie sheet. Place under broiler. Watch them closely as the skin will blister and turn black within minutes. Turn the peppers after 5 minutes to blister all sides evenly. When done, the pepper skins should be evenly blistered and mostly black. Place roasted peppers in a plastic bag, cover with a kitchen towel and when cool, rub off blackened skin. Tear open and pull out the seed pod and stem.
Sauce
In a blender combine the peppers, flour, and half of the suero or buttermilk and blend until creamy. Pour mixture into medium skillet and set over medium-low heat to warm. Add additional suero or buttermilk and stir. Taste and season with salt, usually about 2 teaspoons. If the sauce is too spicy, add  cup of crema or sour cream and stir. If the sauce is too thick, add water until desired consistency is reached.
Chicken (Optional)
In a pot with enough water to cover, boil chicken breasts 25 minutes or until juices run clear. Drain, cool, and shred. Optional time-saver: shred a store bought rotisserie chicken.
Stacked Style
Fry tortillas in hot oil until softened. Drain on paper towels. Soften tortillas by soaking in sauce one at a time. Place softened tortillas on individual serving plates. Layer with cooked chicken, cheese, and onion. Repeat process for a total of 3 tortillas for each serving.
Oven Style
Preheat oven to 350 degrees. Spread 1 cup of the sauce in an ungreased 9-by-13-inch baking dish. Fry tortillas in hot oil just until softened. Drain on paper towels. Fill with cooked chicken, cheese, and onion. Roll, placing seam side down.
Pour 2 cups of the sauce over enchiladas. Sprinkle with crumbled queso fresco and bake until warm, about 15 minutes. Serve with a dollop of crema or sour cream and your favorite side dish.",https://spoonacular.com/recipeImages/642403-556x370.jpg,2022-10-28 13:50:31 UTC,2022-10-28 13:50:31 UTC,
81,Caramelized Onion Dip,"",https://spoonacular.com/recipeImages/716422-556x370.jpg,2022-10-28 13:50:33 UTC,2022-10-28 13:50:33 UTC,
