id,name,steps,image_url,created_at,updated_at,cuisine_id
26,Caprese Quick Bread,"Heat oven to 350. Spray a 9x5x3 loaf pan or two mini bread pans with cooking spray.
Stir together flours,cheese, baking powder, basil and salt in medium bowl. Add olive oil, egg and milk, stir till combined. Fold in sundried tomatoes.
Pour into pan, drizzle melted butter over top of bread. (Bread will be thick, flatten it out with your fingers)
Bake 30 minutes for mini loaf pans and 40  50 minutes for large loaf pan, or until golden brown and toothpick inserted in center comes out clean. Cool 5 minutes, remove from pan to wire rack. Cool 30 minutes before slicing, if you can control yourself!",https://spoonacular.com/recipeImages/636962-556x370.jpg,2022-10-28 13:48:47 UTC,2022-10-28 13:48:47 UTC,
27,The Best Chili,"<ol><li>Brown the lean ground beef in a deep skillet. Cook over medium heat until cooked all the way through, and then drain.</li><li>In a large pan over high heat add in all of your additional ingredients: cooked ground beef, tomato juice, kidney beans, pinto beans, water, tomato paste, chili powder, cumin, black pepper, oregano, sugar, cayenne pepper, bell pepper, and chopped onions.</li><li>Bring to a boil.</li><li>Once your large pot of chili has started to boil, lower the heat and simmer for 2 hours uncovered.</li></ol>",https://spoonacular.com/recipeImages/715424-556x370.jpg,2022-10-28 13:48:49 UTC,2022-10-28 13:48:49 UTC,
28,Moroccan Couscous and Chickpea Salad,"<ol><li>Heat broth and a teaspoon of salt and bring to a boil.</li><li>Place couscous in a bowl and add broth.  Cover bowl to let couscous absorb liquid.</li><li>After  5 minutes, remove cover and fluff couscous with a fork.</li><li>In a large bowl, add the chickpeas, pistachios, red peppers, green onions and parsley and mix well.</li><li>Add the zest and juice of the lemon and mix again.</li><li>Add the spice mixture over the couscous and mix well. Taste, and add salt if needed.</li><li>Let the salad marinate for an hour or so before serving.</li></ol>",https://spoonacular.com/recipeImages/652423-556x370.jpg,2022-10-28 13:48:54 UTC,2022-10-28 13:48:54 UTC,
29,Butternut Squash Risotto With Pancetta and Sage Oil,"Warm stock in small saucepan, keep warm.
In small saut pan warm olive oil with sage leaves until fragrant.  Be careful not to burn leaves.  Cook 5-6 minutes and let cool.
In a medium saucepan melt butter over medium heat.  Add shallots and pancetta.  Saut until  shallots are translucent.
Add rice and stir until coated in butter.
Add wine and cook 2-3 minutes.
Slowly begin adding in stock, 1-2 ladles at a time.  Allow rice to absorb liquid before adding another ladle-full..   Continue to cook until rice is al dente (has a little bite).
Add parmesan and squash puree and mix until smooth and creamy.
Top with a drizzle of sage oil.",https://spoonacular.com/recipeImages/636601-556x370.jpg,2022-10-28 13:48:59 UTC,2022-10-28 13:48:59 UTC,
30,Fried Asparagus,"Bring a medium saucepan with lightly salted water to a boil. Prepare an ice bath (place several cubes with cold water in a bowl). Place the asparagus into the boiling water for 2 to 4 minutes depending on the thickness of the stalks (they should just be pliable but not fully cooked).Remove immediately to the ice bath; when cool, remove to a dish and set aside. Or, you can cook them in the steaming bags for 2 minutes and 30 seconds.
In a small dish (square if possible) beat the eggs, salt, pepper, parsley, and grating cheese together. On your counter or work surface, lay out two paper dishes or wax paper sheets and place the bowl with the egg mixture between them.
Fill the first dish with flour and the second with breadcrumbs. Dip the cooled asparagus into the flour, then the egg mixture and finally into the plain breadcrumbs. Layer the breaded asparagus on a platter lined with waxed paper, and place waxed paper between the layers of asparagus.
Heat a large frying pan with about 1-inch of oil in it. When the oil is hot, fry the asparagus until golden brown. Drain on paper towels. Place on a serving platter. Serve immediately, or you can serve them at room temperature as well.",https://spoonacular.com/recipeImages/643660-556x370.jpg,2022-10-28 13:49:01 UTC,2022-10-28 13:49:01 UTC,
31,Baked Alaska,"Grease a 7-inch bowl (large enough to hold 1/2 gallon ice cream, but not wider than your cake round!) with flavorless oil (see note above) or unsalted butter.
Let ice cream soften until it is workable. Pack tightly in the bowl. Return bowl to freezer until it hardens.
When ready to assemble, beat egg whites until foamy. Add tartar and whip until stiff peaks form. Gently fold in powdered sugar, a little bit at a time.
Place frozen layer cake on a plate slightly larger than the cake. Unmold the ice cream by centering it on the cake. If the ice cream does not release from the bowl, see notes.
Do not trim the cake. ""Frost"" cake and ice cream with meringue, covering completely, creating a decorative pattern by forming peaks with a spoon or spatula.
Bake in preheated at 450 degrees for 6-7 minutes until meringue peaks are golden brown.
Store in freezer until serving time.",https://spoonacular.com/recipeImages/633415-556x370.jpg,2022-10-28 13:49:02 UTC,2022-10-28 13:49:02 UTC,
32,Banana & Cream Cheese Stuffed French Toast,"<ol><li>In a small bowl combine the softened cream cheese, honey, cinnamon, nutmeg and lemon juice, set aside while preparing the batter.</li><li>Whisk together all of the batter ingredients until thoroughly mixed. (This is a breeze if you use a blender.) Pour the batter into a wide, shallow dish (like a pie plate).</li><li>Spread the filling mixture equally over 1 side of each slice of bread, divide the sliced bananas between 4 slices of the bread, top with the remaining 4 slices, press lightly.</li><li>Melt 2 t. butter and 2 t. oil in a 12 inch nonstick skillet over medium heat until the butter foams and then subsides. Working with one sandwich at a time dip both sides in the batter and let the excess drip away, add to the hot pan, repeat with a second sandwich. Cook until golden brown on the first side, around 3-5 minutes, flip and repeat on the second side. Repeat this process with the remaining, oil, butter and sandwiches. To serve, cut into triangles and serve with maple syrup.</li></ol>",https://spoonacular.com/recipeImages/633971-556x370.jpg,2022-10-28 13:49:04 UTC,2022-10-28 13:49:04 UTC,
33,Cherry-Berry Pie With Agave Nectar All-Butter Crust,"<ol><li>Make the crust:</li><li>Pulse the dry ingredients 5-6 times.</li><li>Add 2 sticks of very cold butter (I freeze mine), cut into cubes. Pulse until the ingredients resemble very coarse meal.</li><li>Adding the agave nectar and fiore di Sicilia flavoring (can substitute orange extract) one tablespoon at a time.</li><li>Watch to see the dough just comes together.</li><li>Divide the dough into two parts, one larger than the other.</li><li>Form each into a flat, round shape.</li><li>Wrap each disk in plastic and refrigerate for at least 2 hours.</li><li>While the dough is chilling, make the filling.</li><li>In a large bowl, combine all the filling ingredients.</li><li>Mix until well incorporated (it will be very soupy).</li><li>Take the dough out of the fridge.</li><li>Let it warm enough to be able to roll it out.</li><li>Roll out the crust to fit it to your pie dish.</li><li>You may need to patch some, but none will show to your eaters.</li><li>Wrap the pie dish in plastic and chill for 30 minutes.</li><li>Pour the filling into the crust.</li><li>Again, wrap the pie in plastic and chill.</li><li>Roll out the other dough disk.</li><li>Use your favorite cookie cutters to cut pieces for the top crust.</li><li>Take the pie out of the fridge and decorate the top.</li><li>Just remember to leave spots for steam to escape.</li><li>Cover the edges with foil and bake at 325 degrees F for 40 minutes.</li><li>Remove foil and bake until golden brown top and the filling is bubbling.</li><li>Let cool and enjoy!</li></ol>",https://spoonacular.com/recipeImages/637794-556x370.jpg,2022-10-28 13:49:05 UTC,2022-10-28 13:49:05 UTC,
34,Peach Coconut Ice Cream,"Heat coconut milk and half & half on the stove over medium high in a saucepan until hot and barely bubbling (bring to a low boil). Add sugar; mix to dissolve. Remove from heat.  Pour mixture into a blender along with the chopped peaches. Allow mixture to cool about 10 minutes before pouring mixture in a large container; refrigerate a few hours until cold.
If using an ice cream maker, follow the instructions on your ice cream maker accordingly.
You can also try this without an ice cream maker by putting the ice cream mixture in a freezer-safe container, placing it in the freezer and stirring with a spoon every hour for roughly 8  10 hours.  If you try this without an ice cream maker the consistency will not be as creamy as youd get when using an ice cream maker, but the ice cream will still be great!
If you have leftovers in the freezer, thaw the ice cream at least 10 minutes before attempting to dig in because it will be much stiffer than store-bought ice cream.",https://spoonacular.com/recipeImages/655098-556x370.jpg,2022-10-28 13:49:09 UTC,2022-10-28 13:49:09 UTC,
35,Brown Sugar Sponge Cookie w/ Chocolate Covered Caramels,"<ol><li>Preheat the oven to 375 degrees. Line baking sheets with parchment paper and spray with nonstick cooking spray.</li><li>In the bowl of a stand mixer on medium speed, beat the egg whites until foamy. Add the baking powder, salt and sugar and continue beating on medium speed until stiff peaks form.</li><li>In another bowl combine egg yolks, vanilla and lemon zest, beat with fork until thoroughly mixed. Fold the yolks into the egg white mixture just until combined.</li><li>Sift the flour over the egg mixture and fold in until the batter is smooth and light. Drop just about 2 teaspoons of batter for each cookie about 2 inches apart onto baking sheets. Top each off with a Rolo in the center and press down lightly.</li><li>Bake for 12 minutes or until golden. Cool on the sheets for 5 minutes then move to racks to cool completely.</li></ol>",https://spoonacular.com/recipeImages/636315-556x370.jpg,2022-10-28 13:49:09 UTC,2022-10-28 13:49:09 UTC,
36,"Kale & chickpea stew with cumin, smoked paprika and lime","Warm a few tablespoons of olive oil in a large frying pan over medium heat. Add the shallots, garlic, red pepper and basil and cook till the shallots and garlic start to brown.
Add the sweet potatoes and cook till they start to brown and soften. Add the beer. Cook till its thick and syrupy.
Add the chickpeas, paprika, cumin, raisins and about 2 cups of water. Bring to a boil and reduce heat and simmer till the sweet potato is nice and soft. You might need to add a cup or two more water as you go along, to keep it a consistency that you like.
Chop the kale into small pieces and add to the stew. Cook until everything is mixed and hot through.
Add the butter and lime juice and season with salt and pepper.",https://spoonacular.com/recipeImages/648709-556x370.jpg,2022-10-28 13:49:10 UTC,2022-10-28 13:49:10 UTC,
37,Chicken Cordon Bleu,"<ol><li>Preheat oven to 350 degrees F.</li><li>Butterfly the chicken breasts by slicing half lengthwise but not cutting all the way through. Lay the halved breasts between 2 pieces of plastic wrap. Using the flat side of a meat mallet, gently pound the chicken to 1/4-inch thickness, taking care to not tear or create holes in the meat.</li><li>Lay 2 slices of cheese on each breast, followed by 2 slices of ham, and 2 more of cheese; leaving a 1/2-inch margin on all sides to help seal the roll. Tuck in the sides of the breast and roll up tight like a jellyroll. Squeeze the log gently to seal.</li><li>Season the flour with salt and pepper; spread out on waxed paper or in a flat dish. Mix the breadcrumbs with thyme, kosher salt, pepper, and oil. The oil will help the crust brown. Beat together the eggs and water, the mixture should be fluid. Lightly dust the chicken with flour, then dip in the egg mixture. Gently coat in the bread crumbs.</li><li>Carefully transfer the roulades to a baking pan and bake for 20 minutes until browned and cooked through.</li><li>Serve whole or cut into pinwheels.</li></ol>",https://spoonacular.com/recipeImages/638035-556x370.jpg,2022-10-28 13:49:12 UTC,2022-10-28 13:49:12 UTC,
38,Mexican Casserole,"Take a large pot and ring water to a boil. When finished, place you chicken breasts in to boil for 20 minutes or until cooked. Take a smaller pan and cook rice as directed. Allow both rice and chicken time to cool when once fully cooked. Heat over to 350 degrees. Take cooled chicken breasts and shred, or cut into bite size pieces. Add into a large mixing bowl. Stir in cooked rice, 2 cups of Monterrey Jack cheese, and 1 cup of Cheddar. Stir in both soups, chopped onion, and salsa.Take a 9 x 13 baking dish and coat with non stick spray. Place mixture into the 9 x 13 dish and cover with the remaining cup of cheddar cheese. Bake for 40 minutes. Allow to cool before serving.",https://spoonacular.com/recipeImages/715438-556x370.jpg,2022-10-28 13:49:15 UTC,2022-10-28 13:49:15 UTC,
39,Finger Foods: Frittata Muffins #incredibleEGG,"",https://spoonacular.com/recipeImages/716432-556x370.jpg,2022-10-28 13:49:19 UTC,2022-10-28 13:49:19 UTC,
40,Great Greek Salad,"In a large salad bowl, toss together the cucumbers, olives, roma tomatoes, sun-dried tomatoes, 2 tablespoons reserved sun-dried tomato oil, red onion, vinegar, and seasoning.
Chill until serving.
Right before serving toss in the feta and stir to combine.",https://spoonacular.com/recipeImages/645265-556x370.jpg,2022-10-28 13:49:21 UTC,2022-10-28 13:49:21 UTC,
41,Peanut Butter Sriracha Cookies,"Cream together butter, peanut butter and sugars.
Slowly add in sriracha, eggs and vanilla. Beat until combined.
In another bowl mix together flour, baking powder, baking soda and salt.
Gently mix flour into peanut butter mixture until well combined. Place batter into refrigerator for 1 hour to chill.
Pre-heat oven to 375 degrees.
Roll dough into approx 1 sized balls or use a Medium sized cookie scoop/Size 40  1tbs portion. Dip the top of dough ball into granulated sugar and place onto cookie sheet.
Flatten each ball with a fork, making a criss-cross pattern. Bake for 8-10 minutes or just until the cookies begin to brown. Do NOT over-bake!
Cool on wire racks and enjoy!",https://spoonacular.com/recipeImages/655335-556x370.jpg,2022-10-28 13:49:25 UTC,2022-10-28 13:49:25 UTC,
42,Apple-Cheesecake Tart with Salted Caramel Glaze,"<ol><li>Crust: Using a stand mixer or handheld electric whisk, cream the butter, sugar and vanilla together until lightened. By hand, gently mix in the flour and almonds. Press the resulting crumbs into a 25cm loose-bottomed tin (or several smaller ones if you have decided to make individual servings).</li><li>Custard: Using a stand mixer or handheld electric whisk, cream together the cream cheese and sugar. Add the egg and vanilla and mix to completely combine. Pour into the prepared (uncooked) crust.</li><li>Apples: Slice the apples as thinly as possible - a mandoline is good for this. Toss gently in the sugar, cinnamon and lemon. Leave to soften for 10 minutes or so. Arrange in a layer on top of the custard. Start by laying overlapping apple slices all the way round the edge. Next create the 'rose' - arrange the slices in a spiral, standing the apple slices a little on their edge, until the centre hole is completely filled in. Save the smallest, thinnest pieces for the very centre as they will have to bend the most. Cover the tart with tin foil and bake in a preheated oven set at 190c for 30 minutes (this step helps soften the apples). Remove the foil and bake for 15-25 minutes longer, until the custard is puffed and the apple edges are lightly browned.</li><li>Glaze: When you take the tin foil off the apple tart, start making the glaze. Melt the sugar in a small saucepan over medium-high heat and cook until rich and golden. Add the butter and salt and stir to combine. Add the cream and continue to cook, stirring constantly, until the ingredients have formed a smooth, unified caramel. When the tart looks nearly ready, remove it from the oven and brush with the glaze. Return to the oven and cook for a further few minutes until the glaze is gently bubbling. Cool to room temperature.  Can be kept in the fridge for several days - store in the baking tin and wrap well.</li></ol>",https://spoonacular.com/recipeImages/632625-556x370.jpg,2022-10-28 13:49:26 UTC,2022-10-28 13:49:26 UTC,
43,Stuffed mushrooms and Chow Mein noodles,"Blanch the spinach in a very little water in the microwave oven for 3 minutes on MAX. Drain and coarsely chop. Chop mushroom stems in a blender.
Melt the butter over low heat, add the onion and cook for 1 minute. Add chopped mushroom stems, and saut for 4-5 minutes, stirring often.
Add chopped spinach; stir well and saut 2 more minutes. Remove from the heat.
Mix and combine with a fork in a separate bowl ricotta, blue cheese, chives and pepper into a fine mixture, almost a paste.
Add chopped stalks and spinach mixture, stir and combine thoroughly.
Using a small teaspoon, place mounds of filling on the top of each mushroom cap, pressing slightly to get it down into the cavity.
Mix breadcrumbs and grated Parmesan cheese, sprinkle evenly over each mushroom. Drizzle each filled cap with olive oil.
Place the mushroom caps on a baking sheet lined with parchment paper or silicon sheet, and bake in the oven at 180C for 20 minutes or until the cheese browns a little. Allow to cool for 5 minutes or so before serving.
Meanwhile cook the Chow Mein or rice noodles as directed on the package; drain.
Mix and combine garlic, sour cream and salt and stir into the cooked pasta.
Sprinkle with chopped parsley and served with stuffed mushrooms.",https://spoonacular.com/recipeImages/662054-556x370.jpg,2022-10-28 13:49:28 UTC,2022-10-28 13:49:28 UTC,
44,Baked Scallops With Parma Ham,"Preheat oven to 410 F (210 C / T 7).
Mix breadcrumbs, Parma ham, garlic, parsley and 1 teaspoon of olive oil in a food processor.
Fold a piece of kitchen paper, pour 1 teaspoon of olive oil on it and use it to grease an oven rack.
Place scallops on the greased rack and top them with Parma ham mix.
Pour a dash of olive oil on top and bake in oven for 8 minutes.
Serve as a starter with a few leaves of lamb's lettuce or rocket if you like.",https://spoonacular.com/recipeImages/633786-556x370.jpg,2022-10-28 13:49:30 UTC,2022-10-28 13:49:30 UTC,
45,Slow Cooker Lamb Curry,"<ol><li>Pull out your slow cooker and add everything into the pot with the exception of the yogurt.</li><li>Now turn on your pot, setting it on low for the next 4-6 hours or high for the next 3-5.</li><li>When the time is up, open up your slow cooker, grab your yogurt and stir it into the curry.</li><li>Serve over rice.</li></ol>",https://spoonacular.com/recipeImages/660290-556x370.jpg,2022-10-28 13:49:31 UTC,2022-10-28 13:49:31 UTC,
46,Rotisserie Chicken and Bean Tostadas,"<ol><li>Preheat oven to 350 degrees.</li><li>Place corn tortillas on a cookie sheet and bake for 16-17 minutes or until the edges brown and curl.</li><li>Cool cooked tortillas at room temperature.</li><li>To build the tostadas, start by spreading 1-2 tablespoons of refried beans on each tortilla.</li><li>Next, top with a handful of shredded rotisserie chicken, shredded iceberg lettuce, diced tomato, and guacamole.</li><li>Drizzle with the juice of one lime wedge.</li><li>Sprinkle with cotija cheese.</li><li>Drizzle with salsa.</li><li>Garnish with jalapeos.</li><li>Serve open-faced.</li></ol><p>Makes 6 tostadas. Serving size is 2 tostadas.</p>",https://spoonacular.com/recipeImages/1098354-556x370.jpg,2022-10-28 13:49:36 UTC,2022-10-28 13:49:36 UTC,
47,Shortbread Lemon Bars,"Preheat oven to 350.
Coat a 8 inch square baking ban with no stick cooking spray or line with foil.
Combine flour, confectioners sugar and salt in large mixing bowl.
Add butter and cut into flour with a fork or crumble with your fingers to combine until flour resembles coarse meal.
Press mixture with fingers into even layer over the bottom of the pan.
Refrigerate for 15 minutes, then bake about 20 minutes, or until golden brown.
Combine sugar and flour for the filling in a medium mixing bowl. Whisk in the eggs.
Add lemon juice, milk, and salt; stir to combine.
Pour over baked crust. Sprinkle lemon zest over the filling.
Return to oven and bake 20 minutes, or until firmly set.
Cool on rack. Remove from pan and cut into 9 squares.
Dust with powdered sugar.",https://spoonacular.com/recipeImages/1005367-556x370.jpg,2022-10-28 13:49:40 UTC,2022-10-28 13:49:40 UTC,
48,Raised Doughnuts,"<ol><li>Dissolve yeast by letting stand 5 minutes in warm water without stirring. In a bowl mix the milk, sugar and salt. Add the dissolved yeast. Then stir in egg and shortening.</li><li>Gradually add flour. As dough becomes stiffer, use hands. Knead until smooth and elastic. Put into lightly greased bowl and cover with a damp cloth. Let rise 2 hours. Punch down and let rise for 1 hour. Roll to 1/3 inch thickness. Cut and let rise 30 to 45 minutes. Leave uncovered so crust will form on top. Slip top side down into fat at 375 degrees. Turn and do not pick with fork. Cook approximately 3 minutes.</li><li>Dip in topping and let cool or shake in a brown paper bag with some powdered sugar.</li></ol>",https://spoonacular.com/recipeImages/657761-556x370.jpg,2022-10-28 13:49:41 UTC,2022-10-28 13:49:41 UTC,
49,Parmesan Mashed Potatoes,"<ol><li>Place potatoes in a medium pot and cover with cold water. Bring to a boil, heat to a simmer. Add a generous pinch of salt and continue to simmer until potatoes are fork tender, about 20 minutes. Heat cream, salt and pepper and butter in a medium saucepan over medium heat until steaming hot, about 6 minutes.</li><li>When potatoes are done, drain and return potatoes to pot to dry slightly. Optional: Run potatoes through food mill or potato ricer into pot.</li><li>Add potatoes to the cream and butter mixture. Stir in parmesan cheese, taste for seasoning.</li></ol>",https://spoonacular.com/recipeImages/654679-556x370.jpg,2022-10-28 13:49:43 UTC,2022-10-28 13:49:43 UTC,
50,Crepes Suzette,"<ol><li>FOR THE CREPES: Combine all liquid ingredients in a blender. Add the dry ingredients and 1/4 cup melted butter; mix on high.</li><li>Let batter rest for 30 minutes.</li><li>Heat a nonstick 10 inch skillet over medium high heat. Brush bottom and sides of pan with a bit of melted butter.</li><li>Ladle 1/2 cup batter into skillet and swirl to coat bottom evenly. Cook until lightly browned, about 1-2 minutes. Using a spatula or your fingers, flip the crepe and cook the other side until lightly browned, about 30 seconds to 1 minute.</li><li>Transfer crepes to a platter. Layer crepes over each other with parchment paper in between.</li><li>If necessary, add more butter to the pan. Repeat with the rest of the batter.</li><li>FOR THE SAUCE: Melt 1/4 cup butter in a skillet over LOW fire. Add the sugar and allow to melt. Be patient. Make sure that the heat is at its lowest. Add the lemon juice and mix well. Add the lemon zest.</li><li>Add the crepes, 3-4 at a time and allow to cook in the sauce for 1 minute. Remove from the pan. Arrange on a plate and pour the sauce over the crepes and serve warm.</li><li>Makes 8 crepes. Serving size is 2 crepes.</li></ol>",https://spoonacular.com/recipeImages/640767-556x370.jpg,2022-10-28 13:49:43 UTC,2022-10-28 13:49:43 UTC,
51,Valentine's Chicken Marsala,"Slice mushrooms and pound chicken breast with a mallet between 2 sheets of wax paper to about 1/4 inch. Dredge breast in seasoned crumbs.
Heat a heavy stainless or cast iron pan (don't use non-stick). Add the butter and the olive oil till butter melts and is bubbly. Add chicken breast and brown on both sides.
Remove browned breast. Add additional olive oil and saute mushrooms and garlic.
Deglaze pan with wine.
Add browned chicken breast back to pan. Bring to boil, reduce heat, cover and simmer for 30 min.
Remove chicken from pan. Add cream and reduce sauce 50%.
Serve over cooked pasta, if desired.",https://spoonacular.com/recipeImages/664270-556x370.jpg,2022-10-28 13:49:43 UTC,2022-10-28 13:49:43 UTC,
52,Smoked Salmon Eggs Benedict With Lemon Dill Hollandaise,"<ol><li>Make Lemon Dill Hollandaise:</li><li>Fill a medium saucepan about halfway with water, and bring to a gentle simmer over medium heat. Put the egg yolks and water in a heatproof bowl, season with a pinch of dill (if using dried), salt, and pepper. Whisk the ingredients together and then place the bowl on top of the saucepan. Keep stirring the egg mixture for about 5 minutes or until it begins to thicken. Make sure you dont scramble your eggs! Once the eggs are thickened, take the bowl off the water and set aside.</li><li>Poach the eggs:</li><li>Fill a medium saucepan with water, add a splash of white vinegar (optional, but this helps hold the whites together which results in nicely shaped eggs) and bring to a gentle simmer. You want tiny bubbles only, not a rolling boil. Gently add eggs to water and poach until deisred doneness.</li><li>Meanwhile, toast bread.</li><li>Place toast on plates and top with arugula, spinach and salmon. Place eggs on top of salmon and spoon hollandaise over the top. Garnish with dill, salt and freshly cracked black pepper and serve.</li></ol>",https://spoonacular.com/recipeImages/660368-556x370.jpg,2022-10-28 13:49:44 UTC,2022-10-28 13:49:44 UTC,
